name,location,city,district,address,latitude,longitude,telephone
臺灣集中保管結算所股份有限公司(10F),台北市松山區復興北路363號10樓,台北市,松山區,復興北路363號10樓,25.060561,121.544388,02-25141432
臺北市影視音實驗教育機構,台北市中正區汀州路三段230巷18弄5-2號,台北市,中正區,汀州路三段230巷18弄5-2號,25.010089,121.532141,02-77055355
貝克漢運動健康世界,貝克漢地下一樓門口,台北市,內湖區,民權東路六段15巷1號B1,25.067984,121.580166,02-6602-9969
私立圓心康復之家,機構內,台北市,大安區,羅斯福路2段75號7樓,25.026410,121.523213,02-23632811
臺北市萬華運動中心,3樓櫃檯後方,台北市,萬華區,西寧南路6-1號B2-7樓,25.026286,121.497029,02-23759900#618
臺北市南港運動中心,3樓籃球場,台北市,南港區,玉成街69號,25.048938,121.581840,26532279
統一健身俱樂部-京站館,京站館8樓心肺區,台北市,大同區,市民大道1段209號8樓,25.048786,121.518569,02-25588148
泰山企業股份有限公司,辦公室右側入口,台北市,中山區,長安東路二段99號10樓,25.048569,121.534922,0931-968-860
中華民國紅十字會臺灣省分會,走道,台北市,中正區,博愛路230巷6號,25.033752,121.509952,23814571
臺北市文山區明興里辦公處,臺北市文山區明興里辦公處門前,台北市,文山區,木柵路二段109巷25弄6號,24.990145,121.562851,0917-556568
觀星台北社區管理委員會,D棟閱報室,台北市,文山區,木柵路二段109巷100弄66號1樓,24.992593,121.561685,0928-506209
國立台灣大學-水源校區(思源街18號),水源校區C棟宿舍,台北市,大安區,思源街18號,25.012808,121.529008,33662003
國立台灣大學,管理1號館,台北市,大安區,羅斯福路四段1號,25.013848,121.537891,33662003
國立台灣大學,食科館,台北市,大安區,羅斯福路四段1號,25.013892,121.539117,33662003
國立故宮博物院,展覽館一樓大廳,台北市,士林區,至善路2段221號,25.102350,121.548432,66103600*2267
國立台灣大學-醫學校區,公衛學院,台北市,中正區,仁愛路1段1號,25.041015,121.523260,33662003
國立台灣大學,博雅教學館,台北市,大安區,羅斯福路四段1號,25.018933,121.536850,33662003
國立台灣大學,新農化館,台北市,大安區,羅斯福路四段1號,25.016143,121.535981,33662003
國立台灣大學,第一活動中心,台北市,大安區,羅斯福路四段1號,25.017839,121.540286,33662003
台北醫學大學,拇山學院,台北市,信義區,吳興街250號,25.024402,121.560684,27361661~2250
國立台灣大學,工科海洋館,台北市,大安區,羅斯福路四段1號,25.017100,121.542588,33662003
國立台灣大學,社工館,台北市,大安區,羅斯福路四段1號,25.020061,121.541735,33662003
Breeze Center 微風廣場,GF  L7電梯旁,台北市,松山區,復興南路1段39號,25.046217,121.544326,6600-8888 #3528
國立台灣大學,AED-長興崗亭,台北市,大安區,羅斯福路四段1號,25.017601,121.543730,33662003
鐵人工廠,運動場,台北市,松山區,八德路三段12巷16弄10號1樓,25.047265,121.550096,0955551950
臺北市政府環境保護局內湖垃圾焚化廠,管理大樓1樓廠房電梯前,台北市,內湖區,安康路290號,25.062515,121.605298,02-27961833轉352
誠隆汽車股份有限公司大安服務廠,大安服務廠客休室,台北市,大安區,和平東路三段268號,25.021244,121.555587,0935339636
誠隆汽車股份有限公司木柵服務廠,木柵服務廠出納櫃台,台北市,文山區,木柵路一段257巷1號,24.988156,121.553019,0911831209
誠隆汽車股份有限公司交車中心,交車中心辦公室,台北市,中山區,濱江街199巷1號,25.073389,121.540041,0936174145
聚廠樂活運動館,聚廠樂活運動館(B1),台北市,北投區,北投路二段13號B1-1,25.131104,121.498629,0970708117
長榮國際股份有限公司,國際大樓六樓,台北市,中山區,民生東路二段166號六樓,25.057692,121.534090,02-25001522
香港商世界健身事業有限公司大直分公司,一樓心肺區,台北市,中山區,堤頂大道二段588號、590號,25.084132,121.560893,0986769397
統一健身俱樂部,統一健身俱樂部,台北市,松山區,民生東路5段149號B1,25.059103,121.562120,27673148
交通部公路總局臺北市區監理所,監理所1樓,台北市,松山區,八德路4段21號,25.048478,121.558997,02-27630155#606
日勝生加賀屋國際溫泉飯店,4樓櫃檯後方,台北市,北投區,光明路236號,25.135934,121.506839,02-28985555
北投焚化廠回饋設施洲美運動公園(主題館),北投焚化廠回饋設施洲美運動公園主題館服務台,台北市,北投區,洲美街271號(洲美運動公園),25.109602,121.499364,02-28360050轉162
臺北市北投區公所,北投區行政中心1樓,台北市,北投區,新市街30號4樓,25.132678,121.502759,28912105#207
家福股份有限公司台北桂林分公司,3樓手扶梯梯廳處,台北市,萬華區,桂林路1號,25.037743,121.506290,0937189442
台灣家樂福股份有限公司北投分公司,B1F服務中心,台北市,北投區,中和街366號B1F,25.141693,121.499305,0970843408
華信航空,27排CD行李櫃內,台北市,松山區,敦化北路405巷123弄3號,25.063040,121.557636,0227171188 ext.3603
華信航空,27排CD行李櫃內,台北市,松山區,敦化北路405巷123弄3號,25.063040,121.557636,0227171188 ext.3603
華信航空,27排CD行李櫃內,台北市,松山區,敦化北路405巷123弄3號,25.063040,121.557636,0227171188 ext.3603
天龍三溫暖,大廳,台北市,大同區,重慶北路1段73號9樓,25.052139,121.514196,02-2555-2277
雅芙美容坊(市招維納斯),櫃檯,台北市,大安區,仁愛路4段112巷5號地下室,25.035762,121.549711,0910165266
Curves女性專用30分鐘健身中心內湖成功店,二樓進門左手邊,台北市,內湖區,成功路四段34號二樓,25.081816,121.591676,02-27948659
國立臺灣師範大學,公館校區校門口警衛室內,台北市,文山區,汀州路4段88號,25.007963,121.536905,02-77343107
財團法人台北市文化基金會台北當代藝術館,售票大廳處,台北市,大同區,長安西路39號,25.050725,121.518975,02-25523721#231
交通部民用航空局臺北國際航空站(松山機場)-出境證照查驗大廳,國際線2樓外候機室,台北市,松山區,敦化北路340-9號,25.063676,121.552858,02-87703418
臺北市文山區萬芳國民小學,學校川堂,台北市,文山區,萬和街1號,25.003231,121.567433,22301232*25
台北市立吳興國小,健康中心內,台北市,信義區,松仁路226號,25.025743,121.568716,02-27589615
臺北市立關渡國民中學,學務處走廊,台北市,北投區,知行路212號,25.119885,121.467145,02-28581770*36
臺北市立大學附設實驗國民小學,學生事務處健康中心,台北市,中正區,公園路29號,25.036073,121.515246,23113040*118
玉山商業銀行股份有限公司,玉山銀行總部大樓大門入口右側,台北市,松山區,民生東路3段115號,25.057932,121.546642,02-21751313#8725
臺北市立士林國民中學,繁星樓B1游泳池,台北市,士林區,中正路345號,25.094225,121.522739,02-88613411
台北市私立崇生康復之家,機構活動區,台北市,大同區,重慶北路2段188號3樓,25.062297,121.513358,02-25538802
萬美社區管理委員會,1號1樓梯間,台北市,文山區,萬美街2段2巷1號,25.003439,121.562612,0921887937
財團法人公共電視文化事業基金會,B棟警衛室對面(玻璃門旁),台北市,內湖區,康寧路3段75巷70號B棟,25.080745,121.590836,02-26338191
微風台大醫院,微風台大醫院服務台右邊,台北市,中正區,中山南路7號B1,25.040750,121.518625,0975791292
臺北市立士林國民中學,警衛室內,台北市,士林區,中正路345號,25.094366,121.522570,02-88613411
臺北市政府環境保護局北投垃圾焚化廠,值班宿舍1樓辦公室,台北市,北投區,洲美街271號,25.100116,121.498582,02-28360050轉162
國立臺北藝術大學,展演中心內,台北市,北投區,學園路1號,25.131803,121.469779,02-28938803
微風置地股份有限公司信義分公司,3F服務台旁,台北市,信義區,忠孝東路五段86號3F,25.041035,121.567002,02-66366699#3528
中鼎工程公司,中鼎大樓10F觀景窗旁,台北市,士林區,中山北路六段89號,25.105726,121.524397,28339999轉12225
臺北市松山地政事務所,一樓大廳,台北市,信義區,莊敬路391巷11弄2號,25.028846,121.566153,27230711
民生承安診所,民生承安診所,台北市,中山區,民生東路三段90號,25.057454,121.543485,25032633#233
展昭國際企業(股)公司國立台北護理健康大學水療中心,水療中心,台北市,北投區,明德路365號,25.117796,121.518053,02 28281528
欣葉國際餐飲-台灣料理創始店,1樓門市入口處,台北市,中山區,雙城街34-1號,25.066547,121.524153,0926-238-803
欣葉國際餐飲-101食藝軒,餐廳櫃台右方,台北市,信義區,信義路5段7號85樓之1,25.033718,121.564810,02-8101-0185
欣葉國際餐飲-日本料理中山店,餐廳櫃台入口處,台北市,中山區,中山北路2段52號,25.056304,121.522588,02-2542-5858
仙妮蕾德餐旅管理有限公司 王朝大酒店,1樓大廳,台北市,松山區,敦化北路100號,25.052888,121.548314,2719-7199*3162
台北福華大飯店,飯店大廳,台北市,大安區,仁愛路3段160號,25.037704,121.543377,0955609700
神旺商務酒店,一樓柏晶廳,台北市,中山區,南京東路1段128號,25.051864,121.527041,02-2511-5185
臺北市藝文推廣處-文山劇場,文山劇場一樓大廳休息區,台北市,文山區,景文街32號,24.991961,121.541233,29332199分機506
福德坑環保復育園區,管理辦公室1樓,台北市,文山區,木柵路5段151號,25.007261,121.589505,(02)8230-1969
臺北市立浩然敬老院,致和1樓大廳,台北市,北投區,關渡里知行路75號,25.118367,121.467733,28581081分機318
台北市北投區石牌國民小學,石牌國小警衛室,台北市,北投區,致遠二路80號,25.115729,121.511757,28227484#227
臺北市北投區文林國民小學,健康中心內,台北市,北投區,文林北路155號,25.105905,121.514744,28234212-306
臺北市私立惇敘高級工商職業學校,學務處,台北市,北投區,泉源路221號,25.144552,121.527099,28912630轉181
全真概念健康事業股份有限公司-環亞分公司,9樓櫃台旁,台北市,松山區,南京東路三段337號9樓,25.052006,121.548289,02-27161234
城市學校財團法人臺北城市科技大學,行政大樓1樓健康中心旁,台北市,北投區,學園路2號,25.133617,121.468879,02-2895-2619
凱達格蘭文化館,一樓大廳大門左側,台北市,北投區,中山路3-1號,25.137067,121.505788,02-27206001轉26
北投麗禧溫泉酒店,一樓大廳櫃檯旁,台北市,北投區,幽雅路30號,25.137952,121.514833,0972769826
立偉電子股份有限公司,3樓辦公室內,台北市,大同區,鄭州路139號3樓,25.050395,121.510304,2553-7885#306
中國文化大學推廣教育部 忠孝分部,忠孝分部國際語言中心一樓服務櫃台旁,台北市,中正區,忠孝東路1段41號1樓,25.044512,121.525817,02-27005858#8331
臺北市立龍門國民中學,龍門國中學務處外,台北市,大安區,建國南路2段269號,25.024673,121.538208,02-27330299轉1006
優力國際安全認證有限公司,一樓逃生疏散樓梯旁,台北市,北投區,大業路260號1F,25.126384,121.498596,02-28967790 # 62727
中國人壽保險股份有限公司-總公司,1樓大廳,台北市,松山區,敦化北路122號,25.053985,121.548513,02-25146263
臺北市立五常國民中學,1樓東側川堂男廁旁,台北市,中山區,復興北路430巷1號,25.063482,121.543100,25014320轉101
台灣精品館,台灣精品館,台北市,中山區,中山北路三段181號,25.072594,121.524852,(02)27255200#1355
台北市中山區永安國小,健康中心前走廊,台北市,中山區,明水路397巷19弄1號,25.078776,121.549406,25334799
臺北市立敦化國民小學,健康中心內,台北市,松山區,敦化北路2號,25.049244,121.547884,27529715
潤泰旭展股份有限公司,B棟2樓服務台右側,台北市,南港區,忠孝東路七段369號,25.052749,121.606124,02-2652-9051
跨越體適能有限公司,場館必經出入口,台北市,信義區,和平東路三段333號地下,25.018705,121.558744,0928055110
財團法人公共電視文化事業基金會,C棟大廳警衛室右邊,台北市,內湖區,康寧路3段75巷100號C棟,25.080745,121.590836,02-26338191
康體健身器材有限公司,店內入口處,台北市,中山區,民權西路36號3樓,25.062605,121.521303,0927301027
臺北市萬華區福星國民小學,警衛室,台北市,萬華區,中華路一段66號,25.046784,121.507931,23144668轉132
臺灣菸酒股份有限公司,法務處門口右側,台北市,中正區,南昌路1段四號,25.034070,121.514877,02-23214567#642
臺北市大同區雙蓮國小,活動中心三樓,台北市,大同區,錦西街51號,25.061411,121.517544,02-25570309#1026
國立臺北護理健康大學(城區部),學生活動中心外,台北市,萬華區,內江街89號,25.041755,121.503359,02-28227101*2451
微風置地股份有限公司南京分公司,3F贈獎處旁,台北市,松山區,南京東路三段337號,25.052006,121.548289,02-2175-0999#3528
中鼎工程公司,1F大廳服務台旁,台北市,士林區,中山北路六段89號,25.105726,121.524397,28339999轉12225
臺北市大安地政事務所,1樓大廳,台北市,大安區,信義路4段335巷6號,25.033834,121.556434,(02)2754-8900#402
南海開發大樓,台北市南海路20號一樓,台北市,中正區,南海路20號,25.032422,121.517117,0972110368
臺灣菸酒股份有限公司台北啤酒工場,打卡室內,台北市,中山區,八德路二段85號,25.047119,121.534198,0227719131#392
台北市萬華老人服務中心,台北市萬華老人服務中心,台北市,萬華區,西寧南路4號A棟3樓,25.047900,121.506969,02-23610666
台北亞都麗緻大飯店,台北市民權東路二段41號,台北市,中山區,民權東路2段41號,25.062820,121.530058,02-25971234
臺灣集中保管結算所股份有限公司(7F),台北市松山區復興北路363號7樓,台北市,松山區,復興北路363號7樓,25.060561,121.544388,02-25141432
活泉足體養身世界,大門右側,台北市,中山區,民權東路2段134號1樓,25.062315,121.532887,02-25712017
臺灣集中保管結算所股份有限公司(9F),台北市松山區復興北路363號9樓,台北市,松山區,復興北路363號9樓,25.060561,121.544388,02-25141432
財團法人台灣省私立健順養護中心受託經營管理臺北市南港老人服務暨日間照顧中心,二樓日照中心外,台北市,南港區,重陽路187巷5號,25.057718,121.598498,02-26535311轉13
統一超商股份有限公司總公司,總公司辦公室2F,台北市,信義區,東興路65號2F,25.046907,121.566594,02-2747-8711 #3880
韋德伍斯健身有限公司,館內三樓,台北市,大同區,天水路1號,25.053640,121.514046,0925951256
國立臺灣師範大學,圖書館校區校門口警衛室外,台北市,大安區,和平東路1段129號,25.027352,121.529045,02-77343107
交通部民用航空局臺北國際航空站(松山機場)-出境證照查驗大廳,國際線出境證照查驗大廳,台北市,松山區,敦化北路340-9號,25.063685,121.551645,02-87703418
交通部民用航空局臺北國際航空站(松山機場)-國際線候機室,國際線2樓內候機室,台北市,松山區,敦化北路340-9號,25.064205,121.553397,02-87703418
台灣鐵路管理局臺北運務段萬華車站,一月台行車室,台北市,萬華區,康定路382號,25.033349,121.500442,02-23020481
台象股份有限公司,台象總公司9樓櫃台,台北市,中山區,長安東路2段100號9樓,25.048190,121.535019,02-25069009#328
康寧醫護暨管理專科學校,野聲館,台北市,內湖區,康寧路3段75巷137號,25.076465,121.610531,02-26321181分機430
新光三越百貨股份有限公司台北信義分公司四館,3F醫護室,台北市,信義區,松高路19號,25.039329,121.567026,8789-5599#8509
新光三越百貨股份有限公司台北信義分公司,6F醫護室,台北市,信義區,松壽路11號,25.036218,121.567269,87801000#2086
臺北市北投區立農國小,一樓川堂 電梯旁,台北市,北投區,立農街一段250號,25.119147,121.505128,28210702*211
台北信義威秀影城,2F售票處,台北市,信義區,松壽路20號,25.035636,121.567099,02-87805566#209
時代國際飯店股份有限公司(台北W飯店),1樓員工出入口,台北市,信義區,忠孝東路5段10號,25.040671,121.565975,02-77038911
國立台灣大學-長興校區(長興街50號),男一舍,台北市,大安區,長興街50號,25.016473,121.544436,33662003
國立台灣大學,國青宿舍,台北市,大安區,羅斯福路四段1號,25.020192,121.544470,33662003
國立台灣大學,新生大樓,台北市,大安區,羅斯福路四段1號,25.019740,121.538403,33662003
台北金融大樓股份有限公司,商場2樓中環,台北市,信義區,市府路45號,25.033715,121.564702,02-81018929
國立台灣大學,舊體育館,台北市,大安區,羅斯福路四段1號,25.019701,121.536354,33662003
國立台灣大學,社科學院警衛室,台北市,大安區,羅斯福路四段1號,25.020953,121.541208,33662003
香港商世界健身事業有限公司大安分公司,健身中心三樓入口大廳,台北市,大安區,信義路4段6號三樓,25.033107,121.544108,0988776309
臺北市大安運動中心,一樓大廳,台北市,大安區,辛亥路3段55號,25.020777,121.545636,0919278483
國立台灣大學,行政大樓,台北市,大安區,羅斯福路4段1號,25.016313,121.536802,33662003
香港商世界健身事業有限公司天母分公司,會所一樓,台北市,士林區,中山北路7段34號,25.119924,121.531148,(02)2875-5050
台北金融大樓股份有限公司,商場B1客服櫃台,台北市,信義區,市府路45號,25.033724,121.564724,02-81018929
台北金融大樓股份有限公司,商場B1美食街往辦公大樓電扶梯旁,台北市,信義區,市府路45號,25.033719,121.564735,02-81018929
衛生福利部,3樓西側哺乳室前,台北市,南港區,忠孝東路六段488號,25.050197,121.595335,02-85906522
衛生福利部,8樓西側公共空間,台北市,南港區,忠孝東路六段488號,25.050261,121.595335,02-85906522
陽明山國家公園擎天崗遊客服務站,服務站大門入口處,台北市,士林區,菁山路101巷246號,25.167212,121.574182,0228615404
陽明山國家公園冷水坑遊客服務站,一樓展場內,台北市,士林區,菁山路101巷170號,25.165613,121.563910,(02)2861-0036
長源汽車台北營業處,顧客休息室,台北市,中山區,濱江街321號,25.072432,121.547426,02-25152108
臺北市北投區明德國民小學,一樓健康中心前走廊,台北市,北投區,明德路190號,25.112123,121.521788,(02)2822-9651#1205
台北市北投區關渡國小,健康中心內,台北市,北投區,中央北路4段581號,25.126631,121.466292,28912847#236
Curves女性專用30分鐘健身中心南京三民店,店內運動區,台北市,松山區,台北市南京東路5段202號3F-5,25.051193,121.564752,02-27483316
華山1914文化創意產業園區,小雪人空間,台北市,中正區,八德路一段一號,25.044130,121.529399,02-23581914#582
台北市私立金甌女子高級中學,教官室,台北市,大安區,杭州南路2段1號,25.034768,121.524182,02-23214765#201
國都L濱江廠,服務廠客休室,台北市,中山區,濱江街233號,25.072726,121.541244,2508-1288
臺北市立建成國民中學,大門口警衛室內,台北市,大同區,長安西路37之1號,25.051838,121.518637,02-25587042*626
國家文官學院,行政大樓1樓菁英講堂前,台北市,南港區,忠孝東路7段576號,25.052615,121.613619,02-26531667
國立臺灣科技大學,管理大樓大門左側,台北市,大安區,基隆路4段43號,25.012329,121.541265,02-27376136
交通部民用航空局臺北國際航空站(松山機場)-國際線入境大廳,國際線入境大廳,台北市,松山區,敦化北路340-9號,25.064269,121.551895,02-87703418
交通部臺灣鐵路管理局臺北運務段臺北站,B1F東側出口內方,台北市,中正區,北平西路3號,25.047921,121.516997,02-2381-5226#2476
交通部臺灣鐵路管理局臺北運務段臺北站,B1F西側出口內方,台北市,中正區,北平西路3號,25.047921,121.517158,02-2381-5226#2476
中央研究院,學術活動中心,台北市,南港區,研究院路2段128號,25.041044,121.612617,27852717-1224
市府轉運站,售票大廳,台北市,信義區,忠孝東路5段6號,25.040914,121.565136,02-27221166
德明財經科技大學,綜合大樓六樓體育館,台北市,內湖區,環山路1段56號,25.086741,121.565132,(02)26585801-2241
立法院委員研究大樓,1樓大廳,台北市,中正區,台北市濟南路1段3之1號,25.043032,121.521261,02-23585238
內湖防災科學教育館,1樓入口處,台北市,內湖區,成功路2段376號4樓,25.069350,121.590338,2791-9786
臺北市政府環境保護局山豬窟游泳池館,游泳池館大廳,台北市,南港區,舊莊街1段290巷32號,25.030603,121.623886,2654-8933
國立臺北藝術大學,活動中心衛生保健組,台北市,北投區,學園路1號,25.133197,121.469935,02-28938803
北都汽車股份有限公司-中正廠,1樓辦公室結帳櫃檯後方,台北市,中正區,忠孝東路2段122號,25.042475,121.531596,02-23956502
300壯士跨時代健身中心,健身房入口處,台北市,萬華區,漢口街2段73號B1,25.046304,121.504496,0912989919
台北健身院新生店,入門處左斜方柱子,台北市,大安區,新生南路3段58號B1,25.020429,121.533862,02-23632298
台北國際會議中心,1樓大廳服務台,台北市,信義區,信義路5段1號,25.033690,121.561022,02-27255200ext.3543
台北世貿中心展覽大樓,世貿中心展覽大樓西大門郵局旁,台北市,信義區,信義路5段5號,25.033259,121.562324,02-27251361
Curves 女性專用30分鐘健身中心東湖店,一樓櫃台旁,台北市,內湖區,東湖路33巷17號,25.069596,121.613479,0979679662
國家表演藝術中心國家兩廳院,戲劇院大廳,台北市,中正區,中山南路21-1號,25.035168,121.517812,02-33939583
國都濱江服務廠,服務廠展間,台北市,中山區,濱江街269號,25.072604,121.542531,25158747
Curves女性專用30分鐘健身中心石牌店,櫃檯左後方,台北市,北投區,裕民六路120號5樓,25.114535,121.517648,0935932621
Curves女性專用30分鐘健身中心建國長春店,運動區,台北市,中山區,建國北路二段74號3F,25.055038,121.536441,0910006131
Curves女性專用30分鐘健身中心和平建國店,"2F大門進入,櫃台旁邊約200公分距離",台北市,大安區,和平東路2段53巷2號2樓,25.025870,121.538452,0920095613
北都汽車股份有限公司-lexus敦南所,展示間,台北市,松山區,敦化南路1段25號,25.046326,121.549264,(02)2579-1633
台北市成功高中運動中心,8樓健身房入口旁,台北市,中正區,濟南路一段71號,25.043323,121.523257,0932342067
臺北市立興隆國民小學,大門口警衛室,台北市,文山區,福興路2號,25.002436,121.551888,29323131分機615
國立歷史博物館,3樓展場,台北市,中正區,南海路49號,25.031454,121.511227,02-23610270-316
大河之戀皇后號,一樓客艙接待櫃檯左側,台北市,北投區,關渡碼頭,25.120927,121.461921,0930448833
萬美社區管理委員會,7號樓梯間,台北市,文山區,萬美街2段2巷7號,25.002648,121.562769,0921887937
臺北市大安區老人日間照顧服務,臺北市大安區老人日間照顧服務,台北市,大安區,新生南路三段52-5號5樓,25.021179,121.533992,02-23661321
台灣新光保全股份有限公司3館波士頓大樓,電梯3樓右側,台北市,內湖區,行愛路140巷25號3樓,25.063635,121.579337,(02)7719-9888#20205
台灣新光保全股份有限公司2館優勢領航大樓,3樓左側屋內,台北市,內湖區,新湖二路128號3樓,25.062436,121.578749,7719-9888#21531
北投老人日間照顧中心,台北市北投區裕民六路120號3樓,台北市,北投區,裕民六路120號3樓,25.114535,121.517648,28218267*105
超越體能顧問有限公司,下樓梯右側,台北市,松山區,南京東路四段17號b1,25.051908,121.550245,02-27152733
台北市內湖區南湖國民小學,學校五樓之體育組辦公室外面走廊,台北市,內湖區,康寧路三段200號,25.068697,121.612033,02-26321296#36
陽明海運股份有限公司台灣營業部,陽明海運重慶大樓一樓大廳,台北市,大同區,重慶北路2段243號,25.062502,121.513900,(02)2181-6808
柔昱健康事業有限公司,會館大廳會員休憩區,台北市,中山區,復興北路150號2樓,25.052783,121.543662,02-2712-8722
誠品生活松菸店,B2F誠品電影院,台北市,信義區,菸廠路88號,25.044558,121.561317,0266365888
遠東百貨股份有限公司台北分公司,1樓服務台,台北市,中正區,寶慶路32號,25.041642,121.509108,0931091203
台北君悅酒店,5樓健身中心,台北市,信義區,松壽路2號,25.035486,121.563018,02-27201233
東南亞秀泰影城,2樓販賣部旁邊,台北市,中正區,羅斯福路4段136巷3號,25.012775,121.535355,02-23678999
台北市松山區西松國民小學,總務處前,台北市,松山區,三民路5號,25.052450,121.563517,27609221#340
國立陽明大學醫學院二館1樓,國立陽明大學醫學院二館1樓,台北市,北投區,石牌立農街二段155號醫學院二館1樓,25.122886,121.515884,28267000#2358
藍鵲地景(圓山風景區),藍鵲地景,台北市,中山區,中山北路4段1號,25.079063,121.528468,02-27593001
台北市私立滬江高級中學,滬江高中學務處,台北市,文山區,羅斯福路六段336號,24.989099,121.539259,8663-1122#227
晶華國際酒店股份有限公司,飯店大廳,台北市,中山區,中山北路2段39巷3號,25.054187,121.524240,0930884397
國立臺北科技大學,衛生保健組,台北市,大安區,忠孝東路3段1號,25.043430,121.534249,27712171#1265
京華城全生活廣場,一樓服務台,台北市,松山區,八德路4段138號,25.047620,121.561902,0953552535
